smartctl 7.2 2020-12-30 r5155 [x86_64-linux-6.8.0-40-generic] (local build)
Copyright (C) 2002-20, Bruce Allen, Christian Franke, www.smartmontools.org

=== START OF INFORMATION SECTION ===
Model Family:     Phison Driven SSDs
Device Model:     KINGSTON SA400S37120G
Serial Number:    50026B7773044720
LU WWN Device Id: 5 000000 000000000
Firmware Version: SBFK10D7
User Capacity:    120,034,123,776 bytes [120 GB]
Sector Size:      512 bytes logical/physical
Rotation Rate:    Solid State Device
Form Factor:      2.5 inches
TRIM Command:     Available
Device is:        In smartctl database [for details use: -P show]
ATA Version is:   ACS-4 (minor revision not indicated)
SATA Version is:  SATA 3.2, 6.0 Gb/s (current: 6.0 Gb/s)
Local Time is:    Tue Sep 24 16:27:24 2024 IST
SMART support is: Available - device has SMART capability.
SMART support is: Enabled

=== START OF READ SMART DATA SECTION ===
SMART overall-health self-assessment test result: PASSED

General SMART Values:
Offline data collection status:  (0x00)	Offline data collection activity
					was never started.
					Auto Offline Data Collection: Disabled.
Self-test execution status:      ( 243)	Self-test routine in progress...
					30% of test remaining.
Total time to complete Offline 
data collection: 		(65535) seconds.
Offline data collection
capabilities: 			 (0x79) SMART execute Offline immediate.
					No Auto Offline data collection support.
					Suspend Offline collection upon new
					command.
					Offline surface scan supported.
					Self-test supported.
					Conveyance Self-test supported.
					Selective Self-test supported.
SMART capabilities:            (0x0003)	Saves SMART data before entering
					power-saving mode.
					Supports SMART auto save timer.
Error logging capability:        (0x01)	Error logging supported.
					General Purpose Logging supported.
Short self-test routine 
recommended polling time: 	 (   4) minutes.
Extended self-test routine
recommended polling time: 	 (  32) minutes.
Conveyance self-test routine
recommended polling time: 	 (   8) minutes.

SMART Attributes Data Structure revision number: 16
Vendor Specific SMART Attributes with Thresholds:
ID# ATTRIBUTE_NAME          FLAG     VALUE WORST THRESH TYPE      UPDATED  WHEN_FAILED RAW_VALUE
  1 Raw_Read_Error_Rate     0x000a   100   100   000    Old_age   Always       -       0
  9 Power_On_Hours          0x0012   100   100   000    Old_age   Always       -       35817
 12 Power_Cycle_Count       0x0012   100   100   000    Old_age   Always       -       8826
148 Unknown_Attribute       0x0000   255   255   000    Old_age   Offline      -       0
149 Unknown_Attribute       0x0000   255   255   000    Old_age   Offline      -       281474976710655
167 Write_Protect_Mode      0x0022   100   100   000    Old_age   Always       -       0
168 SATA_Phy_Error_Count    0x0012   100   100   000    Old_age   Always       -       0
169 Bad_Block_Rate          0x0000   100   100   000    Old_age   Offline      -       11
170 Bad_Blk_Ct_Erl/Lat      0x0013   100   100   010    Pre-fail  Always       -       0/21
172 Erase_Fail_Count        0x0032   100   100   000    Old_age   Always       -       0
173 MaxAvgErase_Ct          0x0000   100   100   000    Old_age   Offline      -       381 (Average 330)
181 Program_Fail_Count      0x0012   100   100   000    Old_age   Always       -       0
182 Erase_Fail_Count        0x0000   255   255   000    Old_age   Offline      -       281474976710655
187 Reported_Uncorrect      0x0032   100   100   000    Old_age   Always       -       0
192 Unsafe_Shutdown_Count   0x0012   100   100   000    Old_age   Always       -       6610
194 Temperature_Celsius     0x0023   061   043   000    Pre-fail  Always       -       39 (Min/Max 19/57)
196 Reallocated_Event_Count 0x0000   100   100   000    Old_age   Offline      -       0
199 SATA_CRC_Error_Count    0x0032   100   100   000    Old_age   Always       -       0
218 CRC_Error_Count         0x0000   100   100   000    Old_age   Offline      -       0
231 SSD_Life_Left           0x0013   100   100   000    Pre-fail  Always       -       67
233 Flash_Writes_GiB        0x0013   100   100   000    Pre-fail  Always       -       29460
241 Lifetime_Writes_GiB     0x0012   100   100   000    Old_age   Always       -       30581
242 Lifetime_Reads_GiB      0x0012   100   100   000    Old_age   Always       -       37269
244 Average_Erase_Count     0x0000   100   100   000    Old_age   Offline      -       330
245 Max_Erase_Count         0x0000   100   100   000    Old_age   Offline      -       381
246 Total_Erase_Count       0x0000   100   100   000    Old_age   Offline      -       7190592

SMART Error Log Version: 1
No Errors Logged

SMART Self-test log structure revision number 1
Num  Test_Description    Status                  Remaining  LifeTime(hours)  LBA_of_first_error
# 1  Short offline       Completed without error       00%     35817         -
# 2  Short offline       Completed without error       00%     35817         -
# 3  Short offline       Completed without error       00%     35815         -
# 4  Short offline       Completed without error       00%     35815         -
# 5  Short offline       Completed without error       00%     35815         -
# 6  Short offline       Completed without error       00%     35794         -
# 7  Short offline       Completed without error       00%     35794         -
# 8  Short offline       Completed without error       00%     35794         -
# 9  Short offline       Completed without error       00%     35789         -
#10  Short offline       Completed without error       00%     35788         -
#11  Short offline       Completed without error       00%     35788         -
#12  Short offline       Completed without error       00%     35787         -
#13  Short offline       Completed without error       00%     35787         -
#14  Short offline       Completed without error       00%     35787         -
#15  Short offline       Completed without error       00%     35786         -
#16  Short offline       Completed without error       00%     35786         -
#17  Short offline       Completed without error       00%     35786         -
#18  Short offline       Completed without error       00%     35786         -
#19  Short offline       Completed without error       00%     35786         -
#20  Short offline       Completed without error       00%     35721         -
#21  Short offline       Completed without error       00%     35721         -

SMART Selective self-test log data structure revision number 0
Note: revision number not 1 implies that no selective self-test has ever been run
 SPAN  MIN_LBA  MAX_LBA  CURRENT_TEST_STATUS
    1        0        0  Not_testing
    2        0        0  Not_testing
    3        0        0  Not_testing
    4        0        0  Not_testing
    5        0        0  Not_testing
Selective self-test flags (0x0):
  After scanning selected spans, do NOT read-scan remainder of disk.
If Selective self-test is pending on power-up, resume after 0 minute delay.
